name,description
'Python','The basics of structured programming and problem solving with the programming language Python'
'Javascript1','Programming and problem solving with the programming language JavaScript together with HTML and CSS in a web environment'
'SQL',"'Issues that mainly concern SQL and Databases wihin Anax, mainly MySQL and SQLite.'"
'HTML & PHP',"'Techniques HTML, CSS, PHP and SQL are used to build a database-driven website together'"
'Unix & Linux',"'Questions, functions, tips and tricks on how to get started with Unix- and Linux-based systems.'"
